{
  "incident_id": "inc-d306fda1",
  "project_path": "faultforge/checkout-service",
  "commit_sha": "e53f1d3576bbdf1f9adb17f012beba101f92376a",
  "test_run_id": "run-5c996b48",
  "fault": {
    "type": "latency",
    "target": "shipping-dependency",
    "profile_name": "latency_cascading_hang",
    "profile_hash": "644a89784316",
    "latency_ms": 3500.0,
    "jitter_ms": 250.0
  },
  "observations": {
    "health_check": "degraded",
    "total_probes": 5,
    "failed_probes": 0,
    "sla_breaches": 5,
    "p95_ms": 3918.27,
    "avg_ms": 3742.46
  },
  "confirmed_facts": [
    "Injected Toxiproxy fault: latency (profile hash 644a89784316)",
    "Observed 5 SLA breaches exceeding 1500ms budget",
    "Probe latency: avg 3742.46ms, p95 3918.27ms",
    "AST confirmed outbound call lacks bounded timeout keyword argument in app/clients/shipping_client.py",
    "Git bisect confirmed regressing commit 974035c6e45e7c177452df260a155b6508b828e9 (perf: reuse client, simplify error handling)"
  ],
  "hypotheses": [],
  "evidence": {
    "failed_test": "tests/chaos/test_resilience.py::test_shipping_dependency_chaos_resilience",
    "call_site": "app/clients/shipping_client.py:23",
    "log_excerpt": "HTTP 504 / SLA budget breach: Outbound carrier request exceeded latency threshold",
    "culprit_commit": "974035c6e45e7c177452df260a155b6508b828e9"
  }
}